<?xml version="1.0" encoding="UTF-8"?>
<spawns xmlns:xsi="http://www.w3.org/2001/XMLSchema-instance" xsi:noNamespaceSchemaLocation="../spawns.xsd">
	<spawn_map map_id="300200000">
		<!-- Amethyst -->
		<spawn npc_id="400302">
			<spot x="300.717" y="429.704" z="92.14633"/>
			<spot x="256.169" y="399.106" z="90.26486"/>
			<spot x="323.971" y="415.126" z="91.16717"/>
		</spawn>
		<!-- Crystal -->
		<spawn npc_id="400303">
			<spot x="367.291" y="376.065" z="94.30297"/>
			<spot x="382.143" y="316.132" z="86.82318"/>
			<spot x="386.906" y="282.663" z="91.517334"/>
		</spawn>
		<!-- Rose Quartz -->
		<spawn npc_id="400301">
			<spot x="326.17" y="322.972" z="88.82468"/>
			<spot x="347.481" y="323.342" z="85.86539"/>
			<spot x="326.895" y="352.164" z="88.45613"/>
		</spawn>
		<!-- Silver -->
		<spawn npc_id="400101">
			<spot x="246.437" y="364.112" z="136.52193"/>
			<spot x="213.334" y="359.185" z="139.59756"/>
			<spot x="212.621" y="350.651" z="140.69937"/>
		</spawn>
		<!-- Iron -->
		<spawn npc_id="400202">
			<spot x="69.5883" y="93.2732" z="138.70984"/>
			<spot x="86.3678" y="96.1942" z="139.05595"/>
			<spot x="78.9733" y="126.446" z="139.6161"/>
			<spot x="100.602" y="113.529" z="138.9776"/>
			<spot x="93.4669" y="83.3656" z="142.6956"/>
		</spawn>
	</spawn_map>
</spawns>
