<?xml version="1.0" encoding="utf-8"?>
<spawns xmlns:xsi="http://www.w3.org/2001/XMLSchema-instance" xsi:noNamespaceSchemaLocation="../spawns.xsd">
	<spawn_map map_id="300600000">
		<!-- Artifact of Protection -->
		<spawn npc_id="701589">
			<spot x="326.1492" y="766.9335" z="203.1832" static_id="60" />
		</spawn>
		<!-- Unstable Enos Protector -->
		<spawn npc_id="219577">
			<spot x="660.5268" y="187.8755" z="449.8903" h="100" />
		</spawn>
		<!-- Unstable Enos Watcher -->
		<spawn npc_id="219548">
			<spot x="698.4331" y="431.0002" z="462.0062" h="106" />
		</spawn>
		<!-- Unstable Holy Orkanimum -->
		<spawn npc_id="219545">
			<spot x="650.0816" y="217.2797" z="456.7426" h="12" />
			<spot x="641.2955" y="243.604" z="462.5292" h="106" />
			<spot x="641.8997" y="282.1778" z="462.8441" h="73" />
		</spawn>
		<!-- Drakan Corpse -->
		<spawn npc_id="219585">
			<spot x="648.7668" y="139.6174" z="448.1981" h="6" />
			<spot x="646.4538" y="137.3493" z="448.1777" h="106" />
			<spot x="668.5554" y="154.9271" z="448.8253" h="50" />
			<spot x="646.6642" y="156.4884" z="447.6785" h="66" />
			<spot x="654.4019" y="144.363" z="448.4239" h="66" />
			<spot x="669.1091" y="157.0472" z="448.5819" h="30" />
			<spot x="655.899" y="167.4184" z="448.2086" h="60" />
			<spot x="648.3304" y="165.896" z="448.3096" />
			<spot x="648.9009" y="160.9725" z="447.9388" h="13" />
			<spot x="657.9028" y="144.1364" z="448.7755" />
		</spawn>
		<!-- Kaluva's Unstable Spawner -->
		<spawn npc_id="219583">
			<spot x="643.9534" y="524.2017" z="423.0811" />
		</spawn>
		<!-- Kaluva's Unstable Spawner -->
		<spawn npc_id="219582">
			<spot x="663.1912" y="556.4682" z="424.2755" />
		</spawn>
		<!-- Kaluva's Unstable Spawner -->
		<spawn npc_id="219564">
			<spot x="611.1442" y="539.6695" z="423.248" />
		</spawn>
		<!-- Kaluva's Unstable Spawner -->
		<spawn npc_id="219581">
			<spot x="628.4056" y="585.4481" z="424.3175" />
		</spawn>
		<!-- Unstable Ametgolem of Guarding -->
		<spawn npc_id="219546">
			<spot x="651.1442" y="223.0291" z="458.483" h="86" />
			<spot x="644.4316" y="221.0237" z="458.5358" h="100" />
			<spot x="642.2816" y="249.2099" z="462.6751" h="93" />
			<spot x="636.8633" y="246.3414" z="462.9286" h="100" />
			<spot x="647.5186" y="286.8143" z="463.2379" h="80" />
			<spot x="641.1099" y="285.9602" z="463.0914" h="100" />
		</spawn>
		<!-- Unstable Dayshade -->
		<spawn npc_id="219578">
			<spot x="451.2862" y="692.8484" z="432.7655" h="113" />
		</spawn>
		<!-- Unstable Kaluva the Fourth -->
		<spawn npc_id="219553">
			<spot x="634.77765" y="557.0182" z="425.0" h="113" />
		</spawn>
		<!-- Unstable Pazuzu -->
		<spawn npc_id="219554">
			<spot x="669.5757" y="335.1355" z="465.8946" h="76" />
		</spawn>
		<!-- (Unstable) Abyssal Splinter Exit -->
		<spawn npc_id="730317">
			<spot x="719.756" y="161.833" z="449.343" h="40" />
		</spawn>
		<!-- Unstable Flash Lapilimo -->
		<spawn npc_id="219550">
			<spot x="808.18" y="647.51" z="454.8155" h="96" walker_id="D27F46DA44D94DF1F306CC5303FC3DA5BC9CFF68" />
			<spot x="796.89" y="617.22" z="455.28043" h="106" walker_id="934333BE62E29B8CE5903F68064329CB7822C348" />
			<spot x="756.64" y="648.51" z="445.75342" h="6" walker_id="0FA349227F68EA9E502AD2FCC8EDB0C884C4D597" />
		</spawn>
		<!-- Ancient Treasure Box -->
		<spawn npc_id="701574">
			<spot x="270.4710" y="743.9896" z="319.3749" h="106" />
			<spot x="280.9925" y="767.5568" z="287.4333" h="66" />
			<spot x="290.2162" y="729.6007" z="253.7787" h="16" />
			<spot x="306.5070" y="715.2716" z="368.3994" h="6" />
			<spot x="311.6450" y="768.0681" z="343.8409" h="106" />
			<spot x="344.2876" y="778.7310" z="397.5779" h="33" />
			<spot x="346.9677" y="742.3782" z="365.1365" />
			<spot x="347.3535" y="735.8599" z="419.6725" h="66" />
			<spot x="350.4549" y="788.7392" z="320.6760" h="106" />
			<spot x="360.1270" y="684.1302" z="390.9752" h="33" />
			<spot x="368.2921" y="771.3032" z="347.4754" />
			<spot x="389.8283" y="763.1230" z="274.2615" h="40" />
		</spawn>
		<!-- Unstable Noble Lapilima -->
		<spawn npc_id="219560">
			<spot x="807.04" y="630.01" z="454.5897" h="100" walker_id="51EE14337303BC33A670F05D1E9E836FBF87A764" />
			<spot x="762.52" y="605.41" z="461.67227" h="40" walker_id="FDA8CA3EFAC4AF61BFB3E6AB3C42F904D3393DD4" />
		</spawn>
		<!-- Unstable Enos Grappler -->
		<spawn npc_id="219547">
			<spot x="534.35" y="666.26" z="426.174" static_id="78" walker_id="8AE2C4F2BDE907BF79BB9331C19165E1F45A2B2F" />
			<spot x="565.0715" y="621.3477" z="419.6656" h="89" />
			<spot x="581.05" y="640.2924" z="419.8894" h="60" />
			<spot x="522.2446" y="666.4486" z="427.9431" h="113" />
		</spawn>
		<!-- Death Reception -->
		<spawn npc_id="282013">
			<spot x="447.2670" y="695.3739" z="433.2287" h="113" />
		</spawn>
		<!-- Unstable Noble Lapilimo -->
		<spawn npc_id="219549">
			<spot x="790.75" y="656.64" z="452.78162" walker_id="5B4EE494D9D6D1129E5F1F10C73F9A407620A987" />
			<spot x="737.50" y="645.28" z="439.23276" walker_id="7F3CB60F7B5F5659DB6D0AE7F85D32C522B8A018" />
		</spawn>
		<!-- Ranx Highmagus -->
		<spawn npc_id="281921">
			<spot x="646.0072" y="154.4628" z="447.5803" />
			<spot x="648.1384" y="147.954" z="447.6975" />
			<spot x="646.6024" y="143.1012" z="447.7108" />
			<spot x="647.2216" y="151.446" z="447.4834" h="75" />
		</spawn>
		<!-- Unstable Flash Lapilimo -->
		<spawn npc_id="219562">
			<spot x="707.61" y="619.79" z="430.36194" h="14" walker_id="5D3362983430627E52A9B1F5F376492E901D208F" />
			<spot x="756.76" y="600.93" z="462.77676" walker_id="36F2F3011475C7A48FC834581BAA573EC6A15152" />
		</spawn>
		<!-- Unstable Flash Lapilimo -->
		<spawn npc_id="219561">
			<spot x="780.35" y="651.83" z="449.6864" walker_id="0484DFAF4890199218D1972975495DDF4DAB6B3B" />
		</spawn>
		<!-- Ranx Vindicator -->
		<spawn npc_id="281920">
			<spot x="641.5420" y="151.0970" z="447.3923" h="114" />
			<spot x="641.9771" y="153.3460" z="447.5465" h="95" />
			<spot x="643.0240" y="149.7030" z="447.2498" h="36" />
			<spot x="645.9310" y="150.8680" z="447.4655" />
			<spot x="646.7925" y="146.6156" z="447.6143" h="45" />
			<spot x="648.1770" y="144.2580" z="447.8127" />
		</spawn>
		<!-- Teleportation Device -->
		<spawn npc_id="283202">
			<spot x="302.201" y="735.16" z="197.668" h="17" />
			<spot x="334.001" y="707.736" z="197.779" h="32" />
			<spot x="362.192" y="741.592" z="197.301" h="67" />
		</spawn>
	</spawn_map>
</spawns>